{
  "contract": 1,
  "source": "sdk",
  "suite": "sdk-unit",
  "commit": "ae40545",
  "branch": "main",
  "run_id": "38146398357",
  "finished_at": "2026-10-11T14:15:16.407Z",
  "results": [
    {
      "test_id": "agent.test.mjs::defaults register only read tools [feat:sdk.agent.tools]",
      "features": [
        "sdk.agent.tools"
      ],
      "status": "passed",
      "duration_ms": 1,
      "retries": 0
    },
    {
      "test_id": "agent.test.mjs::capability grants add tools; fs:none removes fs tools [feat:sdk.agent.tools]",
      "features": [
        "sdk.agent.tools"
      ],
      "status": "passed",
      "duration_ms": 0,
      "retries": 0
    },
    {
      "test_id": "agent.test.mjs::prefix namespaces tool names [feat:sdk.agent.tools]",
      "features": [
        "sdk.agent.tools"
      ],
      "status": "passed",
      "duration_ms": 0,
      "retries": 0
    },
    {
      "test_id": "agent.test.mjs::read tools work over sync (Nano) fs [feat:sdk.agent.tools]",
      "features": [
        "sdk.agent.tools"
      ],
      "status": "passed",
      "duration_ms": 5,
      "retries": 0
    },
    {
      "test_id": "agent.test.mjs::read tools work over async (worker) fs [feat:sdk.agent.tools]",
      "features": [
        "sdk.agent.tools"
      ],
      "status": "passed",
      "duration_ms": 0,
      "retries": 0
    },
    {
      "test_id": "agent.test.mjs::approve gates mutating calls only [feat:sdk.agent.approve]",
      "features": [
        "sdk.agent.approve"
      ],
      "status": "passed",
      "duration_ms": 0,
      "retries": 0
    },
    {
      "test_id": "agent.test.mjs::errors, exit codes and truncation come back as text [feat:sdk.agent.tools]",
      "features": [
        "sdk.agent.tools"
      ],
      "status": "passed",
      "duration_ms": 0,
      "retries": 0
    },
    {
      "test_id": "agent.test.mjs::run_node treats exit 134 as benign; delete_path refuses / [feat:sdk.agent.tools]",
      "features": [
        "sdk.agent.tools"
      ],
      "status": "passed",
      "duration_ms": 0,
      "retries": 0
    },
    {
      "test_id": "agent.test.mjs::exposeWebMcp registers tools with hints and unregisters [feat:sdk.agent.webmcp]",
      "features": [
        "sdk.agent.webmcp"
      ],
      "status": "passed",
      "duration_ms": 0,
      "retries": 0
    },
    {
      "test_id": "agent.test.mjs::tools drive a real VM [feat:sdk.agent.tools]",
      "features": [
        "sdk.agent.tools"
      ],
      "status": "passed",
      "duration_ms": 353,
      "retries": 0
    },
    {
      "test_id": "code.test.mjs::run() executes a BusyBox command and captures stdout [feat:sdk.code.run]",
      "features": [
        "sdk.code.run"
      ],
      "status": "passed",
      "duration_ms": 80,
      "retries": 0
    },
    {
      "test_id": "code.test.mjs::shExec() runs a real sh pipeline [feat:sdk.code.exec]",
      "features": [
        "sdk.code.exec"
      ],
      "status": "passed",
      "duration_ms": 254,
      "retries": 0
    },
    {
      "test_id": "code.test.mjs::exec() single-quotes argv and runs it through sh [feat:sdk.code.exec]",
      "features": [
        "sdk.code.exec"
      ],
      "status": "passed",
      "duration_ms": 1,
      "retries": 0
    },
    {
      "test_id": "code.test.mjs::overlapping run/shExec/fs calls are serialized, not clobbered [feat:sdk.code.exec]",
      "features": [
        "sdk.code.exec"
      ],
      "status": "passed",
      "duration_ms": 377,
      "retries": 0
    },
    {
      "test_id": "node.test.mjs::node() cold-runs a script and prints its output [feat:sdk.node.runtime]",
      "features": [
        "sdk.node.runtime"
      ],
      "status": "skipped",
      "duration_ms": 0,
      "retries": 0
    },
    {
      "test_id": "node.test.mjs::nodeRuntime warms a snapshot and restores it [feat:sdk.node.runtime]",
      "features": [
        "sdk.node.runtime"
      ],
      "status": "skipped",
      "duration_ms": 0,
      "retries": 0
    },
    {
      "test_id": "node.test.mjs::nodeRuntime restores are isolated from each other [feat:sdk.node.runtime]",
      "features": [
        "sdk.node.runtime"
      ],
      "status": "skipped",
      "duration_ms": 0,
      "retries": 0
    },
    {
      "test_id": "scripting.test.mjs::script eval marshals a JSON result [feat:sdk.scripting.eval]",
      "features": [
        "sdk.scripting.eval"
      ],
      "status": "passed",
      "duration_ms": 98,
      "retries": 0
    },
    {
      "test_id": "scripting.test.mjs::registerFunction + defineGlobal drive a long-lived engine [feat:sdk.scripting.eval]",
      "features": [
        "sdk.scripting.eval"
      ],
      "status": "passed",
      "duration_ms": 4,
      "retries": 0
    },
    {
      "test_id": "scripting.test.mjs::a script with no run grant cannot reach nano.run [feat:sdk.scripting.capability]",
      "features": [
        "sdk.scripting.capability"
      ],
      "status": "passed",
      "duration_ms": 1,
      "retries": 0
    },
    {
      "test_id": "scripting.test.mjs::fs:readonly + run grants let a script drive the VM [feat:sdk.scripting.capability]",
      "features": [
        "sdk.scripting.capability"
      ],
      "status": "passed",
      "duration_ms": 5,
      "retries": 0
    },
    {
      "test_id": "serve.test.mjs::parseHttpResponse parses status line, headers, and body [feat:sdk.serve.http]",
      "features": [
        "sdk.serve.http"
      ],
      "status": "passed",
      "duration_ms": 65,
      "retries": 0
    },
    {
      "test_id": "serve.test.mjs::parseHttpResponse decodes Transfer-Encoding: chunked [feat:sdk.serve.http]",
      "features": [
        "sdk.serve.http"
      ],
      "status": "passed",
      "duration_ms": 0,
      "retries": 0
    },
    {
      "test_id": "serve.test.mjs::startServer rejects when the launch exits before readiness [feat:sdk.serve.http]",
      "features": [
        "sdk.serve.http"
      ],
      "status": "passed",
      "duration_ms": 4,
      "retries": 0
    },
    {
      "test_id": "shell.test.mjs::export persists across shell.run() calls [feat:sdk.shell.session]",
      "features": [
        "sdk.shell.session"
      ],
      "status": "passed",
      "duration_ms": 79,
      "retries": 0
    },
    {
      "test_id": "shell.test.mjs::cd tracks cwd across runs [feat:sdk.shell.session]",
      "features": [
        "sdk.shell.session"
      ],
      "status": "passed",
      "duration_ms": 129,
      "retries": 0
    },
    {
      "test_id": "shell.test.mjs::constructor env seeds the session environment [feat:sdk.shell.session]",
      "features": [
        "sdk.shell.session"
      ],
      "status": "passed",
      "duration_ms": 2,
      "retries": 0
    },
    {
      "test_id": "terminal.test.mjs::clear builtin emits the terminal reset sequence [feat:sdk.mode.terminal]",
      "features": [
        "sdk.mode.terminal"
      ],
      "status": "passed",
      "duration_ms": 66,
      "retries": 0
    },
    {
      "test_id": "terminal.test.mjs::pwd builtin renders the tracked cwd without spawning [feat:sdk.mode.terminal]",
      "features": [
        "sdk.mode.terminal"
      ],
      "status": "passed",
      "duration_ms": 0,
      "retries": 0
    },
    {
      "test_id": "terminal.test.mjs::onData streams command output as it is produced [feat:sdk.mode.terminal]",
      "features": [
        "sdk.mode.terminal"
      ],
      "status": "passed",
      "duration_ms": 6,
      "retries": 0
    },
    {
      "test_id": "vfs.test.mjs::writeFile + readText round-trip through MemFS [feat:sdk.vfs.rw]",
      "features": [
        "sdk.vfs.rw"
      ],
      "status": "passed",
      "duration_ms": 64,
      "retries": 0
    },
    {
      "test_id": "vfs.test.mjs::exists reflects file presence [feat:sdk.vfs.rw]",
      "features": [
        "sdk.vfs.rw"
      ],
      "status": "passed",
      "duration_ms": 0,
      "retries": 0
    },
    {
      "test_id": "vfs.test.mjs::mkdir + copy + walk via BusyBox [feat:sdk.vfs.rw]",
      "features": [
        "sdk.vfs.rw"
      ],
      "status": "passed",
      "duration_ms": 255,
      "retries": 0
    },
    {
      "test_id": "vfs.test.mjs::list returns typed directory entries [feat:sdk.vfs.rw]",
      "features": [
        "sdk.vfs.rw"
      ],
      "status": "passed",
      "duration_ms": 0,
      "retries": 0
    }
  ]
}
