{
  "contract": 1,
  "source": "nano",
  "suite": "cargo-unit",
  "commit": "b3fd06a",
  "branch": "main",
  "run_id": "39566470752",
  "finished_at": "2026-10-21T08:04:24.409Z",
  "results": [
    {
      "test_id": "decode::tests::c_sw_expands_to_store_opcode",
      "features": [
        "emulator.cpu.decode-rvc"
      ],
      "status": "passed",
      "duration_ms": 4,
      "retries": 0,
      "trace_url": "https://github.com/userland-run/nano/actions/runs/39566470752"
    },
    {
      "test_id": "decode::tests::c_addi_expands_to_opimm",
      "features": [
        "emulator.cpu.decode-rvc"
      ],
      "status": "passed",
      "duration_ms": 4,
      "retries": 0,
      "trace_url": "https://github.com/userland-run/nano/actions/runs/39566470752"
    },
    {
      "test_id": "decode::tests::c_lw_expands_to_load_opcode",
      "features": [
        "emulator.cpu.decode-rvc"
      ],
      "status": "passed",
      "duration_ms": 4,
      "retries": 0,
      "trace_url": "https://github.com/userland-run/nano/actions/runs/39566470752"
    },
    {
      "test_id": "decode::tests::c_nop_is_canonical_nop",
      "features": [
        "emulator.cpu.decode-rvc"
      ],
      "status": "passed",
      "duration_ms": 4,
      "retries": 0,
      "trace_url": "https://github.com/userland-run/nano/actions/runs/39566470752"
    },
    {
      "test_id": "decode::tests::illegal_compressed_returns_zero",
      "features": [
        "emulator.cpu.decode-rvc"
      ],
      "status": "passed",
      "duration_ms": 4,
      "retries": 0,
      "trace_url": "https://github.com/userland-run/nano/actions/runs/39566470752"
    },
    {
      "test_id": "types::tests::fsrequest_path_buffers_are_256",
      "features": [
        "emulator.types.layout"
      ],
      "status": "passed",
      "duration_ms": 3,
      "retries": 0,
      "trace_url": "https://github.com/userland-run/nano/actions/runs/39566470752"
    },
    {
      "test_id": "types::tests::a0_and_sp_register_offsets",
      "features": [
        "emulator.types.layout"
      ],
      "status": "passed",
      "duration_ms": 4,
      "retries": 0,
      "trace_url": "https://github.com/userland-run/nano/actions/runs/39566470752"
    },
    {
      "test_id": "decode::tests::non_compressed_returns_zero",
      "features": [
        "emulator.cpu.decode-rvc"
      ],
      "status": "passed",
      "duration_ms": 4,
      "retries": 0,
      "trace_url": "https://github.com/userland-run/nano/actions/runs/39566470752"
    },
    {
      "test_id": "types::tests::host_shared_offsets_are_stable",
      "features": [
        "emulator.types.layout"
      ],
      "status": "passed",
      "duration_ms": 3,
      "retries": 0,
      "trace_url": "https://github.com/userland-run/nano/actions/runs/39566470752"
    },
    {
      "test_id": "types::tests::vm_size_is_locked",
      "features": [
        "emulator.types.layout"
      ],
      "status": "passed",
      "duration_ms": 3,
      "retries": 0,
      "trace_url": "https://github.com/userland-run/nano/actions/runs/39566470752"
    }
  ]
}
