{
  "contract": 1,
  "source": "nano",
  "suite": "node-harness",
  "commit": "46210dc",
  "branch": "main",
  "run_id": "38128232151",
  "finished_at": "2026-10-11T09:25:29.947Z",
  "results": [
    {
      "test_id": "hello",
      "features": [
        "emulator.elf.load"
      ],
      "status": "passed",
      "retries": 0,
      "trace_url": "https://github.com/userland-run/nano/actions/runs/38128232151"
    },
    {
      "test_id": "test_suite",
      "features": [
        "emulator.cpu.decode-rv64"
      ],
      "status": "passed",
      "retries": 0,
      "trace_url": "https://github.com/userland-run/nano/actions/runs/38128232151"
    },
    {
      "test_id": "test_rvc",
      "features": [
        "emulator.cpu.decode-rvc"
      ],
      "status": "passed",
      "retries": 0,
      "trace_url": "https://github.com/userland-run/nano/actions/runs/38128232151"
    },
    {
      "test_id": "test_memory",
      "features": [
        "emulator.mem.bounds"
      ],
      "status": "passed",
      "retries": 0,
      "trace_url": "https://github.com/userland-run/nano/actions/runs/38128232151"
    },
    {
      "test_id": "test_syscalls",
      "features": [
        "emulator.process.exit"
      ],
      "status": "passed",
      "retries": 0,
      "trace_url": "https://github.com/userland-run/nano/actions/runs/38128232151"
    },
    {
      "test_id": "test_float",
      "features": [
        "emulator.cpu.fpu"
      ],
      "status": "passed",
      "retries": 0,
      "trace_url": "https://github.com/userland-run/nano/actions/runs/38128232151"
    },
    {
      "test_id": "busybox echo",
      "features": [
        "busybox.echo"
      ],
      "status": "passed",
      "retries": 0,
      "trace_url": "https://github.com/userland-run/nano/actions/runs/38128232151"
    },
    {
      "test_id": "busybox true",
      "features": [
        "busybox.true"
      ],
      "status": "passed",
      "retries": 0,
      "trace_url": "https://github.com/userland-run/nano/actions/runs/38128232151"
    },
    {
      "test_id": "busybox false",
      "features": [
        "busybox.false"
      ],
      "status": "passed",
      "retries": 0,
      "trace_url": "https://github.com/userland-run/nano/actions/runs/38128232151"
    },
    {
      "test_id": "busybox uname",
      "features": [
        "busybox.uname",
        "emulator.syscall.uname"
      ],
      "status": "passed",
      "retries": 0,
      "trace_url": "https://github.com/userland-run/nano/actions/runs/38128232151"
    },
    {
      "test_id": "busybox basename",
      "features": [
        "busybox.basename"
      ],
      "status": "passed",
      "retries": 0,
      "trace_url": "https://github.com/userland-run/nano/actions/runs/38128232151"
    },
    {
      "test_id": "busybox dirname",
      "features": [
        "busybox.dirname"
      ],
      "status": "passed",
      "retries": 0,
      "trace_url": "https://github.com/userland-run/nano/actions/runs/38128232151"
    },
    {
      "test_id": "busybox cat",
      "features": [
        "busybox.cat"
      ],
      "status": "passed",
      "retries": 0,
      "trace_url": "https://github.com/userland-run/nano/actions/runs/38128232151"
    },
    {
      "test_id": "busybox head",
      "features": [
        "busybox.head"
      ],
      "status": "passed",
      "retries": 0,
      "trace_url": "https://github.com/userland-run/nano/actions/runs/38128232151"
    },
    {
      "test_id": "busybox tail",
      "features": [
        "busybox.tail"
      ],
      "status": "passed",
      "retries": 0,
      "trace_url": "https://github.com/userland-run/nano/actions/runs/38128232151"
    },
    {
      "test_id": "busybox sort",
      "features": [
        "busybox.sort"
      ],
      "status": "passed",
      "retries": 0,
      "trace_url": "https://github.com/userland-run/nano/actions/runs/38128232151"
    },
    {
      "test_id": "busybox id",
      "features": [
        "busybox.id"
      ],
      "status": "passed",
      "retries": 0,
      "trace_url": "https://github.com/userland-run/nano/actions/runs/38128232151"
    },
    {
      "test_id": "busybox pwd",
      "features": [
        "busybox.pwd",
        "emulator.syscall.getcwd"
      ],
      "status": "passed",
      "retries": 0,
      "trace_url": "https://github.com/userland-run/nano/actions/runs/38128232151"
    },
    {
      "test_id": "busybox env",
      "features": [
        "busybox.env"
      ],
      "status": "passed",
      "retries": 0,
      "trace_url": "https://github.com/userland-run/nano/actions/runs/38128232151"
    },
    {
      "test_id": "busybox whoami",
      "features": [
        "busybox.whoami"
      ],
      "status": "passed",
      "retries": 0,
      "trace_url": "https://github.com/userland-run/nano/actions/runs/38128232151"
    },
    {
      "test_id": "busybox hostname",
      "features": [
        "busybox.hostname"
      ],
      "status": "passed",
      "retries": 0,
      "trace_url": "https://github.com/userland-run/nano/actions/runs/38128232151"
    },
    {
      "test_id": "busybox printf",
      "features": [
        "busybox.printf"
      ],
      "status": "passed",
      "retries": 0,
      "trace_url": "https://github.com/userland-run/nano/actions/runs/38128232151"
    },
    {
      "test_id": "busybox seq",
      "features": [
        "busybox.seq"
      ],
      "status": "passed",
      "retries": 0,
      "trace_url": "https://github.com/userland-run/nano/actions/runs/38128232151"
    }
  ]
}
